{
  "schema_version": "carnet.model_union/2",
  "brand": "Toyota",
  "model": "bZ3",
  "generated_from": {
    "evidence_file": "evidence/toyota/bz3.json",
    "researched_at": "2026-10-03",
    "record_count": 3,
    "source_count": 2,
    "records_by_source_tier": {
      "1": 2,
      "5": 1
    },
    "records_by_integrity_state": {
      "FULL_TEXT_VERIFIED": 0,
      "PDF_VERIFIED": 0,
      "SNIPPET_ONLY": 3,
      "UNAVAILABLE": 0,
      "RETRIEVED_UNVERIFIABLE": 0
    },
    "sources_by_integrity_state": {
      "FULL_TEXT_VERIFIED": 0,
      "PDF_VERIFIED": 0,
      "SNIPPET_ONLY": 2,
      "UNAVAILABLE": 0,
      "RETRIEVED_UNVERIFIABLE": 0
    },
    "records_passing_integrity_test": 0
  },
  "research_coverage": [
    "China (FAW Toyota bZ3 sedan, announced Oct 2022): Toyota Global newsroom (tier 1, snippet) for body/seats/identity; hiluckev.com parameter sheet (tier 5, snippet) for doors",
    "NOT researched: motor power/torque and battery per version (a tier-5 sheet lists 135/180 kW and 49.92/65.28 kWh but its column mapping is ambiguous in the snippet, so it was NOT turned into records), trims, drivetrain wording, transmission, model years",
    "Identity: bZ3 (sedan) is kept separate from bZ3X, bZ3C, bZ4X and bZ5"
  ],
  "vocabulary_version": "carnet.vocabulary/1",
  "production_policy": {
    "production_bound_section": "verified",
    "verified_requires": "tier 1-3 AND source integrity FULL_TEXT_VERIFIED or PDF_VERIFIED AND quote found in the preserved snapshot AND no unresolved tier 1-3 conflict",
    "includes_provisional": false,
    "includes_needs_source_retrieval": false,
    "provisional_values_live_in": "provisional_only (research output only; never auto-promoted)",
    "needs_source_retrieval_values_live_in": "needs_source_retrieval (tier 1-3 evidence whose source content was never validated; never auto-promoted)",
    "unresolved_conflicts": 0,
    "conflicts_block_promotion_until_reviewed": false,
    "review_status": "UNREVIEWED"
  },
  "verified": {
    "trims": [],
    "engine_sizes": [],
    "cylinders": [],
    "fuel_types": [],
    "transmissions": [],
    "transmission_variants": [],
    "transmission_gears": [],
    "drivetrains": [],
    "body_types": [],
    "seats": [],
    "doors": []
  },
  "union": {
    "trims": [],
    "engine_sizes": [],
    "cylinders": [],
    "fuel_types": [],
    "transmissions": [],
    "transmission_variants": [],
    "transmission_gears": [],
    "drivetrains": [],
    "body_types": [],
    "seats": [],
    "doors": []
  },
  "provisional_only": {
    "trims": [],
    "engine_sizes": [],
    "cylinders": [],
    "fuel_types": [],
    "transmissions": [],
    "transmission_variants": [],
    "transmission_gears": [],
    "drivetrains": [],
    "body_types": [],
    "seats": [],
    "doors": [
      4
    ]
  },
  "needs_source_retrieval": {
    "trims": [],
    "engine_sizes": [],
    "cylinders": [],
    "fuel_types": [
      "Electric"
    ],
    "transmissions": [],
    "transmission_variants": [],
    "transmission_gears": [],
    "drivetrains": [],
    "body_types": [
      "Sedan"
    ],
    "seats": [
      5
    ],
    "doors": []
  },
  "empty_dimensions": [
    "trims",
    "engine_sizes",
    "cylinders",
    "transmissions",
    "transmission_variants",
    "transmission_gears",
    "drivetrains"
  ],
  "engines": [],
  "details": {
    "trims": [],
    "engine_sizes": [],
    "cylinders": [],
    "fuel_types": [
      {
        "value": "Electric",
        "status": "NEEDS_SOURCE_RETRIEVAL",
        "integrity_states": [
          "SNIPPET_ONLY"
        ],
        "validated_record_ids": [],
        "best_tier": 1,
        "max_confidence": 0.75,
        "support_count": 1,
        "record_ids": [
          "BT-001"
        ],
        "source_ids": [
          "BT-S1"
        ],
        "markets": [
          "cn"
        ],
        "years": null,
        "in_conflict": false
      }
    ],
    "transmissions": [],
    "transmission_variants": [],
    "transmission_gears": [],
    "drivetrains": [],
    "body_types": [
      {
        "value": "Sedan",
        "status": "NEEDS_SOURCE_RETRIEVAL",
        "integrity_states": [
          "SNIPPET_ONLY"
        ],
        "validated_record_ids": [],
        "best_tier": 1,
        "max_confidence": 0.75,
        "support_count": 2,
        "record_ids": [
          "BT-001",
          "BT-003"
        ],
        "source_ids": [
          "BT-S1",
          "BT-S2"
        ],
        "markets": [
          "cn"
        ],
        "years": null,
        "in_conflict": false
      }
    ],
    "seats": [
      {
        "value": 5,
        "status": "NEEDS_SOURCE_RETRIEVAL",
        "integrity_states": [
          "SNIPPET_ONLY"
        ],
        "validated_record_ids": [],
        "best_tier": 1,
        "max_confidence": 0.75,
        "support_count": 2,
        "record_ids": [
          "BT-002",
          "BT-003"
        ],
        "source_ids": [
          "BT-S1",
          "BT-S2"
        ],
        "markets": [
          "cn"
        ],
        "years": null,
        "in_conflict": false
      }
    ],
    "doors": [
      {
        "value": 4,
        "status": "PROVISIONAL",
        "integrity_states": [
          "SNIPPET_ONLY"
        ],
        "validated_record_ids": [],
        "best_tier": 5,
        "max_confidence": 0.15,
        "support_count": 1,
        "record_ids": [
          "BT-003"
        ],
        "source_ids": [
          "BT-S2"
        ],
        "markets": [
          "cn"
        ],
        "years": null,
        "in_conflict": false
      }
    ]
  },
  "conflicts": []
}
