{
  "schema_version": "carnet.model_union/2",
  "brand": "Toyota",
  "model": "Urban Cruiser",
  "generated_from": {
    "evidence_file": "evidence/toyota/urban_cruiser.json",
    "researched_at": "2026-10-03",
    "record_count": 9,
    "source_count": 3,
    "records_by_source_tier": {
      "1": 3,
      "2": 6
    },
    "records_by_integrity_state": {
      "FULL_TEXT_VERIFIED": 0,
      "PDF_VERIFIED": 4,
      "SNIPPET_ONLY": 5,
      "UNAVAILABLE": 0,
      "RETRIEVED_UNVERIFIABLE": 0
    },
    "sources_by_integrity_state": {
      "FULL_TEXT_VERIFIED": 0,
      "PDF_VERIFIED": 1,
      "SNIPPET_ONLY": 2,
      "UNAVAILABLE": 0,
      "RETRIEVED_UNVERIFIABLE": 0
    },
    "records_passing_integrity_test": 4
  },
  "research_coverage": [
    "UK 2025/2026 all-new battery-electric Urban Cruiser (49 kWh and 61 kWh, FWD): Toyota UK full release PDF, UK media launch page and UK brochure",
    "NOT researched: the 2009-2014 Urban Cruiser hatchback (1.33L/1.4D-4D, FWD/AWD), the India-market Urban Cruiser (1.5L petrol, 5MT/6AT; Hyryder-based), Urban Cruiser Taisor, AllGrip-e AWD (not offered in UK), markets other than UK",
    "Identity: only the 2025+ electric model was researched; the legacy dataset spans 2008-2025 and lists petrol/diesel engines that this evidence does not cover"
  ],
  "vocabulary_version": "carnet.vocabulary/1",
  "production_policy": {
    "production_bound_section": "verified",
    "verified_requires": "tier 1-3 AND source integrity FULL_TEXT_VERIFIED or PDF_VERIFIED AND quote found in the preserved snapshot AND no unresolved tier 1-3 conflict",
    "includes_provisional": false,
    "includes_needs_source_retrieval": false,
    "provisional_values_live_in": "provisional_only (research output only; never auto-promoted)",
    "needs_source_retrieval_values_live_in": "needs_source_retrieval (tier 1-3 evidence whose source content was never validated; never auto-promoted)",
    "unresolved_conflicts": 0,
    "conflicts_block_promotion_until_reviewed": false,
    "review_status": "UNREVIEWED"
  },
  "verified": {
    "trims": [],
    "engine_sizes": [],
    "cylinders": [],
    "fuel_types": [
      "Electric"
    ],
    "transmissions": [],
    "transmission_variants": [],
    "transmission_gears": [],
    "drivetrains": [
      "FWD"
    ],
    "body_types": [
      "SUV"
    ],
    "seats": [],
    "doors": []
  },
  "union": {
    "trims": [],
    "engine_sizes": [],
    "cylinders": [],
    "fuel_types": [
      "Electric"
    ],
    "transmissions": [],
    "transmission_variants": [],
    "transmission_gears": [],
    "drivetrains": [
      "FWD"
    ],
    "body_types": [
      "SUV"
    ],
    "seats": [],
    "doors": []
  },
  "provisional_only": {
    "trims": [],
    "engine_sizes": [],
    "cylinders": [],
    "fuel_types": [],
    "transmissions": [],
    "transmission_variants": [],
    "transmission_gears": [],
    "drivetrains": [],
    "body_types": [],
    "seats": [],
    "doors": []
  },
  "needs_source_retrieval": {
    "trims": [
      "Design",
      "Excel",
      "Icon"
    ],
    "engine_sizes": [],
    "cylinders": [],
    "fuel_types": [],
    "transmissions": [
      "Automatic"
    ],
    "transmission_variants": [],
    "transmission_gears": [
      1
    ],
    "drivetrains": [],
    "body_types": [],
    "seats": [
      5
    ],
    "doors": [
      5
    ]
  },
  "empty_dimensions": [
    "engine_sizes",
    "cylinders",
    "transmission_variants"
  ],
  "engines": [],
  "details": {
    "trims": [
      {
        "value": "Design",
        "status": "NEEDS_SOURCE_RETRIEVAL",
        "integrity_states": [
          "SNIPPET_ONLY"
        ],
        "validated_record_ids": [],
        "best_tier": 1,
        "max_confidence": 0.75,
        "support_count": 1,
        "record_ids": [
          "UC-006"
        ],
        "source_ids": [
          "UC-S2"
        ],
        "markets": [
          "other:uk"
        ],
        "years": null,
        "in_conflict": false
      },
      {
        "value": "Excel",
        "status": "NEEDS_SOURCE_RETRIEVAL",
        "integrity_states": [
          "SNIPPET_ONLY"
        ],
        "validated_record_ids": [],
        "best_tier": 1,
        "max_confidence": 0.75,
        "support_count": 1,
        "record_ids": [
          "UC-007"
        ],
        "source_ids": [
          "UC-S2"
        ],
        "markets": [
          "other:uk"
        ],
        "years": null,
        "in_conflict": false
      },
      {
        "value": "Icon",
        "status": "NEEDS_SOURCE_RETRIEVAL",
        "integrity_states": [
          "SNIPPET_ONLY"
        ],
        "validated_record_ids": [],
        "best_tier": 1,
        "max_confidence": 0.75,
        "support_count": 1,
        "record_ids": [
          "UC-005"
        ],
        "source_ids": [
          "UC-S2"
        ],
        "markets": [
          "other:uk"
        ],
        "years": null,
        "in_conflict": false
      }
    ],
    "engine_sizes": [],
    "cylinders": [],
    "fuel_types": [
      {
        "value": "Electric",
        "status": "VERIFIED",
        "integrity_states": [
          "PDF_VERIFIED",
          "SNIPPET_ONLY"
        ],
        "validated_record_ids": [
          "UC-001"
        ],
        "best_tier": 2,
        "max_confidence": 0.83,
        "support_count": 2,
        "record_ids": [
          "UC-001",
          "UC-009"
        ],
        "source_ids": [
          "UC-S1",
          "UC-S3"
        ],
        "markets": [
          "other:uk"
        ],
        "years": null,
        "in_conflict": false
      }
    ],
    "transmissions": [
      {
        "value": "Automatic",
        "status": "NEEDS_SOURCE_RETRIEVAL",
        "integrity_states": [
          "SNIPPET_ONLY"
        ],
        "validated_record_ids": [],
        "best_tier": 2,
        "max_confidence": 0.7,
        "support_count": 1,
        "record_ids": [
          "UC-009"
        ],
        "source_ids": [
          "UC-S3"
        ],
        "markets": [
          "other:uk"
        ],
        "years": null,
        "in_conflict": false
      }
    ],
    "transmission_variants": [],
    "transmission_gears": [
      {
        "value": 1,
        "status": "NEEDS_SOURCE_RETRIEVAL",
        "integrity_states": [
          "SNIPPET_ONLY"
        ],
        "validated_record_ids": [],
        "best_tier": 2,
        "max_confidence": 0.7,
        "support_count": 1,
        "record_ids": [
          "UC-009"
        ],
        "source_ids": [
          "UC-S3"
        ],
        "markets": [
          "other:uk"
        ],
        "years": null,
        "in_conflict": false
      }
    ],
    "drivetrains": [
      {
        "value": "FWD",
        "status": "VERIFIED",
        "integrity_states": [
          "PDF_VERIFIED",
          "SNIPPET_ONLY"
        ],
        "validated_record_ids": [
          "UC-002"
        ],
        "best_tier": 2,
        "max_confidence": 0.83,
        "support_count": 2,
        "record_ids": [
          "UC-002",
          "UC-009"
        ],
        "source_ids": [
          "UC-S1",
          "UC-S3"
        ],
        "markets": [
          "other:uk"
        ],
        "years": null,
        "in_conflict": false
      }
    ],
    "body_types": [
      {
        "value": "SUV",
        "status": "VERIFIED",
        "integrity_states": [
          "PDF_VERIFIED",
          "SNIPPET_ONLY"
        ],
        "validated_record_ids": [
          "UC-001"
        ],
        "best_tier": 2,
        "max_confidence": 0.83,
        "support_count": 2,
        "record_ids": [
          "UC-001",
          "UC-008"
        ],
        "source_ids": [
          "UC-S1",
          "UC-S3"
        ],
        "markets": [
          "other:uk"
        ],
        "years": null,
        "in_conflict": false
      }
    ],
    "seats": [
      {
        "value": 5,
        "status": "NEEDS_SOURCE_RETRIEVAL",
        "integrity_states": [
          "SNIPPET_ONLY"
        ],
        "validated_record_ids": [],
        "best_tier": 2,
        "max_confidence": 0.7,
        "support_count": 1,
        "record_ids": [
          "UC-008"
        ],
        "source_ids": [
          "UC-S3"
        ],
        "markets": [
          "other:uk"
        ],
        "years": null,
        "in_conflict": false
      }
    ],
    "doors": [
      {
        "value": 5,
        "status": "NEEDS_SOURCE_RETRIEVAL",
        "integrity_states": [
          "SNIPPET_ONLY"
        ],
        "validated_record_ids": [],
        "best_tier": 2,
        "max_confidence": 0.7,
        "support_count": 1,
        "record_ids": [
          "UC-008"
        ],
        "source_ids": [
          "UC-S3"
        ],
        "markets": [
          "other:uk"
        ],
        "years": null,
        "in_conflict": false
      }
    ]
  },
  "conflicts": []
}
