{
  "schema_version": "carnet.model_union/2",
  "brand": "Toyota",
  "model": "bZ4X",
  "generated_from": {
    "evidence_file": "evidence/toyota/bz4x.json",
    "researched_at": "2026-10-03",
    "record_count": 18,
    "source_count": 6,
    "records_by_source_tier": {
      "1": 11,
      "2": 7
    },
    "records_by_integrity_state": {
      "FULL_TEXT_VERIFIED": 10,
      "PDF_VERIFIED": 7,
      "SNIPPET_ONLY": 1,
      "UNAVAILABLE": 0,
      "RETRIEVED_UNVERIFIABLE": 0
    },
    "sources_by_integrity_state": {
      "FULL_TEXT_VERIFIED": 2,
      "PDF_VERIFIED": 3,
      "SNIPPET_ONLY": 1,
      "UNAVAILABLE": 0,
      "RETRIEVED_UNVERIFIABLE": 0
    },
    "records_passing_integrity_test": 17
  },
  "research_coverage": [
    "US 2023 launch (XLE/Limited, FWD/AWD): Toyota USA newsroom launch release + 2023 e-brochure",
    "US 2026 model-year update (renamed 'bZ' by Toyota; same model line, XLE/Limited, FWD/AWD): Toyota USA newsroom release + 2026 vehicle page snippet",
    "UK/Europe 2023-2024 (150 kW FWD / 2 x 80 kW AWD, 71.4 kWh) and UK 2026 (Icon/Design grades) press packs",
    "NOT researched: Japan, China (bZ4X by GAC/FAW Toyota), Middle East, Australia, bZ4X Touring, doors, transmission (single-speed reduction gear is not stated by any fetched source)",
    "Identity: Toyota USA states the model 'receives a name change, switching from the Toyota bZ4X to the Toyota bZ' for MY2026; records for 2026 US are kept under bZ4X because the newsroom names it the same vehicle"
  ],
  "vocabulary_version": "carnet.vocabulary/1",
  "production_policy": {
    "production_bound_section": "verified",
    "verified_requires": "tier 1-3 AND source integrity FULL_TEXT_VERIFIED or PDF_VERIFIED AND quote found in the preserved snapshot AND no unresolved tier 1-3 conflict",
    "includes_provisional": false,
    "includes_needs_source_retrieval": false,
    "provisional_values_live_in": "provisional_only (research output only; never auto-promoted)",
    "needs_source_retrieval_values_live_in": "needs_source_retrieval (tier 1-3 evidence whose source content was never validated; never auto-promoted)",
    "unresolved_conflicts": 0,
    "conflicts_block_promotion_until_reviewed": false,
    "review_status": "UNREVIEWED"
  },
  "verified": {
    "trims": [
      "Design",
      "Icon",
      "Limited",
      "XLE"
    ],
    "engine_sizes": [],
    "cylinders": [],
    "fuel_types": [
      "Electric"
    ],
    "transmissions": [],
    "transmission_variants": [],
    "transmission_gears": [],
    "drivetrains": [
      "AWD",
      "FWD"
    ],
    "body_types": [
      "SUV"
    ],
    "seats": [
      5
    ],
    "doors": []
  },
  "union": {
    "trims": [
      "Design",
      "Icon",
      "Limited",
      "XLE"
    ],
    "engine_sizes": [],
    "cylinders": [],
    "fuel_types": [
      "Electric"
    ],
    "transmissions": [],
    "transmission_variants": [],
    "transmission_gears": [],
    "drivetrains": [
      "AWD",
      "FWD"
    ],
    "body_types": [
      "SUV"
    ],
    "seats": [
      5
    ],
    "doors": []
  },
  "provisional_only": {
    "trims": [],
    "engine_sizes": [],
    "cylinders": [],
    "fuel_types": [],
    "transmissions": [],
    "transmission_variants": [],
    "transmission_gears": [],
    "drivetrains": [],
    "body_types": [],
    "seats": [],
    "doors": []
  },
  "needs_source_retrieval": {
    "trims": [],
    "engine_sizes": [],
    "cylinders": [],
    "fuel_types": [],
    "transmissions": [],
    "transmission_variants": [],
    "transmission_gears": [],
    "drivetrains": [],
    "body_types": [],
    "seats": [],
    "doors": []
  },
  "empty_dimensions": [
    "engine_sizes",
    "cylinders",
    "transmissions",
    "transmission_variants",
    "transmission_gears",
    "doors"
  ],
  "engines": [],
  "details": {
    "trims": [
      {
        "value": "Design",
        "status": "VERIFIED",
        "integrity_states": [
          "PDF_VERIFIED"
        ],
        "validated_record_ids": [
          "BX-018"
        ],
        "best_tier": 2,
        "max_confidence": 0.88,
        "support_count": 1,
        "record_ids": [
          "BX-018"
        ],
        "source_ids": [
          "BX-S5"
        ],
        "markets": [
          "other:uk"
        ],
        "years": [
          2026,
          2026
        ],
        "in_conflict": false
      },
      {
        "value": "Icon",
        "status": "VERIFIED",
        "integrity_states": [
          "PDF_VERIFIED"
        ],
        "validated_record_ids": [
          "BX-017"
        ],
        "best_tier": 2,
        "max_confidence": 0.88,
        "support_count": 1,
        "record_ids": [
          "BX-017"
        ],
        "source_ids": [
          "BX-S5"
        ],
        "markets": [
          "other:uk"
        ],
        "years": [
          2026,
          2026
        ],
        "in_conflict": false
      },
      {
        "value": "Limited",
        "status": "VERIFIED",
        "integrity_states": [
          "FULL_TEXT_VERIFIED"
        ],
        "validated_record_ids": [
          "BX-002",
          "BX-012"
        ],
        "best_tier": 1,
        "max_confidence": 0.93,
        "support_count": 2,
        "record_ids": [
          "BX-002",
          "BX-012"
        ],
        "source_ids": [
          "BX-S1",
          "BX-S2"
        ],
        "markets": [
          "us"
        ],
        "years": [
          2023,
          2026
        ],
        "in_conflict": false
      },
      {
        "value": "XLE",
        "status": "VERIFIED",
        "integrity_states": [
          "FULL_TEXT_VERIFIED"
        ],
        "validated_record_ids": [
          "BX-001",
          "BX-011"
        ],
        "best_tier": 1,
        "max_confidence": 0.93,
        "support_count": 2,
        "record_ids": [
          "BX-001",
          "BX-011"
        ],
        "source_ids": [
          "BX-S1",
          "BX-S2"
        ],
        "markets": [
          "us"
        ],
        "years": [
          2023,
          2026
        ],
        "in_conflict": false
      }
    ],
    "engine_sizes": [],
    "cylinders": [],
    "fuel_types": [
      {
        "value": "Electric",
        "status": "VERIFIED",
        "integrity_states": [
          "FULL_TEXT_VERIFIED",
          "PDF_VERIFIED",
          "SNIPPET_ONLY"
        ],
        "validated_record_ids": [
          "BX-003",
          "BX-004",
          "BX-006",
          "BX-007"
        ],
        "best_tier": 1,
        "max_confidence": 0.93,
        "support_count": 5,
        "record_ids": [
          "BX-003",
          "BX-004",
          "BX-006",
          "BX-007",
          "BX-016"
        ],
        "source_ids": [
          "BX-S2",
          "BX-S3",
          "BX-S6"
        ],
        "markets": [
          "us"
        ],
        "years": [
          2023,
          2026
        ],
        "in_conflict": false
      }
    ],
    "transmissions": [],
    "transmission_variants": [],
    "transmission_gears": [],
    "drivetrains": [
      {
        "value": "AWD",
        "status": "VERIFIED",
        "integrity_states": [
          "FULL_TEXT_VERIFIED",
          "PDF_VERIFIED"
        ],
        "validated_record_ids": [
          "BX-004",
          "BX-007",
          "BX-010",
          "BX-013"
        ],
        "best_tier": 1,
        "max_confidence": 0.93,
        "support_count": 4,
        "record_ids": [
          "BX-004",
          "BX-007",
          "BX-010",
          "BX-013"
        ],
        "source_ids": [
          "BX-S1",
          "BX-S2",
          "BX-S3",
          "BX-S4"
        ],
        "markets": [
          "other:uk",
          "us"
        ],
        "years": [
          2023,
          2026
        ],
        "in_conflict": false
      },
      {
        "value": "FWD",
        "status": "VERIFIED",
        "integrity_states": [
          "FULL_TEXT_VERIFIED",
          "PDF_VERIFIED"
        ],
        "validated_record_ids": [
          "BX-003",
          "BX-006",
          "BX-009",
          "BX-014",
          "BX-017",
          "BX-018"
        ],
        "best_tier": 1,
        "max_confidence": 0.93,
        "support_count": 6,
        "record_ids": [
          "BX-003",
          "BX-006",
          "BX-009",
          "BX-014",
          "BX-017",
          "BX-018"
        ],
        "source_ids": [
          "BX-S1",
          "BX-S2",
          "BX-S3",
          "BX-S4",
          "BX-S5"
        ],
        "markets": [
          "other:uk",
          "us"
        ],
        "years": [
          2023,
          2026
        ],
        "in_conflict": false
      }
    ],
    "body_types": [
      {
        "value": "SUV",
        "status": "VERIFIED",
        "integrity_states": [
          "FULL_TEXT_VERIFIED",
          "SNIPPET_ONLY"
        ],
        "validated_record_ids": [
          "BX-005"
        ],
        "best_tier": 1,
        "max_confidence": 0.93,
        "support_count": 2,
        "record_ids": [
          "BX-005",
          "BX-016"
        ],
        "source_ids": [
          "BX-S2",
          "BX-S6"
        ],
        "markets": [
          "us"
        ],
        "years": [
          2023,
          2026
        ],
        "in_conflict": false
      }
    ],
    "seats": [
      {
        "value": 5,
        "status": "VERIFIED",
        "integrity_states": [
          "PDF_VERIFIED"
        ],
        "validated_record_ids": [
          "BX-008"
        ],
        "best_tier": 2,
        "max_confidence": 0.88,
        "support_count": 1,
        "record_ids": [
          "BX-008"
        ],
        "source_ids": [
          "BX-S3"
        ],
        "markets": [
          "us"
        ],
        "years": [
          2023,
          2023
        ],
        "in_conflict": false
      }
    ],
    "doors": []
  },
  "conflicts": []
}
