{
  "schema_version": "carnet.model_union/2",
  "brand": "Toyota",
  "model": "Wigo",
  "generated_from": {
    "evidence_file": "evidence/toyota/wigo.json",
    "researched_at": "2026-10-03",
    "record_count": 5,
    "source_count": 3,
    "records_by_source_tier": {
      "3": 5
    },
    "records_by_integrity_state": {
      "FULL_TEXT_VERIFIED": 0,
      "PDF_VERIFIED": 0,
      "SNIPPET_ONLY": 5,
      "UNAVAILABLE": 0,
      "RETRIEVED_UNVERIFIABLE": 0
    },
    "sources_by_integrity_state": {
      "FULL_TEXT_VERIFIED": 0,
      "PDF_VERIFIED": 0,
      "SNIPPET_ONLY": 3,
      "UNAVAILABLE": 0,
      "RETRIEVED_UNVERIFIABLE": 0
    },
    "records_passing_integrity_test": 0
  },
  "research_coverage": [
    "Philippines current Wigo (1.0L 1KR-VE 3-cylinder; G CVT, E CVT, J M/T 5-speed): Toyota Motor Philippines site, its comparison page and a dealer-hosted copy of the Toyota Motor Philippines leaflet (Oct 2024)",
    "All sources are search-result snippets (retrieval 'search_snippet_only'); full pages were not cached",
    "NOT researched: Wigo drivetrain (the PH sheet labels 'Drivetrain' but the snippet drops the value), body type, doors, Indonesia/India/Japan markets, the 2014-2022 first generation the legacy dataset mostly lists, model years"
  ],
  "vocabulary_version": "carnet.vocabulary/1",
  "production_policy": {
    "production_bound_section": "verified",
    "verified_requires": "tier 1-3 AND source integrity FULL_TEXT_VERIFIED or PDF_VERIFIED AND quote found in the preserved snapshot AND no unresolved tier 1-3 conflict",
    "includes_provisional": false,
    "includes_needs_source_retrieval": false,
    "provisional_values_live_in": "provisional_only (research output only; never auto-promoted)",
    "needs_source_retrieval_values_live_in": "needs_source_retrieval (tier 1-3 evidence whose source content was never validated; never auto-promoted)",
    "unresolved_conflicts": 0,
    "conflicts_block_promotion_until_reviewed": false,
    "review_status": "UNREVIEWED"
  },
  "verified": {
    "trims": [],
    "engine_sizes": [],
    "cylinders": [],
    "fuel_types": [],
    "transmissions": [],
    "transmission_variants": [],
    "transmission_gears": [],
    "drivetrains": [],
    "body_types": [],
    "seats": [],
    "doors": []
  },
  "union": {
    "trims": [],
    "engine_sizes": [],
    "cylinders": [],
    "fuel_types": [],
    "transmissions": [],
    "transmission_variants": [],
    "transmission_gears": [],
    "drivetrains": [],
    "body_types": [],
    "seats": [],
    "doors": []
  },
  "provisional_only": {
    "trims": [],
    "engine_sizes": [],
    "cylinders": [],
    "fuel_types": [],
    "transmissions": [],
    "transmission_variants": [],
    "transmission_gears": [],
    "drivetrains": [],
    "body_types": [],
    "seats": [],
    "doors": []
  },
  "needs_source_retrieval": {
    "trims": [
      "E",
      "G",
      "J"
    ],
    "engine_sizes": [
      "1.0L"
    ],
    "cylinders": [
      3
    ],
    "fuel_types": [
      "Petrol"
    ],
    "transmissions": [
      "Automatic",
      "Manual"
    ],
    "transmission_variants": [
      "CVT"
    ],
    "transmission_gears": [
      5
    ],
    "drivetrains": [],
    "body_types": [],
    "seats": [
      5
    ],
    "doors": []
  },
  "empty_dimensions": [
    "drivetrains",
    "body_types",
    "doors"
  ],
  "engines": [
    {
      "engine_size_label": "1.0L",
      "displacement_cc": [
        998
      ],
      "cylinders": [
        3
      ],
      "fuel_types": [
        "Petrol"
      ],
      "aspirations": [],
      "power_hp": [
        {
          "value": 66.1,
          "record_id": "WG-004",
          "trim": null
        }
      ],
      "torque_nm": [
        {
          "value": 89.0,
          "record_id": "WG-004",
          "trim": null
        }
      ],
      "best_tier": 3,
      "record_ids": [
        "WG-004"
      ]
    }
  ],
  "details": {
    "trims": [
      {
        "value": "E",
        "status": "NEEDS_SOURCE_RETRIEVAL",
        "integrity_states": [
          "SNIPPET_ONLY"
        ],
        "validated_record_ids": [],
        "best_tier": 3,
        "max_confidence": 0.6,
        "support_count": 1,
        "record_ids": [
          "WG-002"
        ],
        "source_ids": [
          "WG-S1"
        ],
        "markets": [
          "other:ph"
        ],
        "years": null,
        "in_conflict": false
      },
      {
        "value": "G",
        "status": "NEEDS_SOURCE_RETRIEVAL",
        "integrity_states": [
          "SNIPPET_ONLY"
        ],
        "validated_record_ids": [],
        "best_tier": 3,
        "max_confidence": 0.6,
        "support_count": 1,
        "record_ids": [
          "WG-001"
        ],
        "source_ids": [
          "WG-S1"
        ],
        "markets": [
          "other:ph"
        ],
        "years": null,
        "in_conflict": false
      },
      {
        "value": "J",
        "status": "NEEDS_SOURCE_RETRIEVAL",
        "integrity_states": [
          "SNIPPET_ONLY"
        ],
        "validated_record_ids": [],
        "best_tier": 3,
        "max_confidence": 0.6,
        "support_count": 1,
        "record_ids": [
          "WG-003"
        ],
        "source_ids": [
          "WG-S1"
        ],
        "markets": [
          "other:ph"
        ],
        "years": null,
        "in_conflict": false
      }
    ],
    "engine_sizes": [
      {
        "value": "1.0L",
        "status": "NEEDS_SOURCE_RETRIEVAL",
        "integrity_states": [
          "SNIPPET_ONLY"
        ],
        "validated_record_ids": [],
        "best_tier": 3,
        "max_confidence": 0.55,
        "support_count": 1,
        "record_ids": [
          "WG-004"
        ],
        "source_ids": [
          "WG-S3"
        ],
        "markets": [
          "other:ph"
        ],
        "years": null,
        "in_conflict": false
      }
    ],
    "cylinders": [
      {
        "value": 3,
        "status": "NEEDS_SOURCE_RETRIEVAL",
        "integrity_states": [
          "SNIPPET_ONLY"
        ],
        "validated_record_ids": [],
        "best_tier": 3,
        "max_confidence": 0.6,
        "support_count": 4,
        "record_ids": [
          "WG-001",
          "WG-002",
          "WG-003",
          "WG-004"
        ],
        "source_ids": [
          "WG-S1",
          "WG-S3"
        ],
        "markets": [
          "other:ph"
        ],
        "years": null,
        "in_conflict": false
      }
    ],
    "fuel_types": [
      {
        "value": "Petrol",
        "status": "NEEDS_SOURCE_RETRIEVAL",
        "integrity_states": [
          "SNIPPET_ONLY"
        ],
        "validated_record_ids": [],
        "best_tier": 3,
        "max_confidence": 0.55,
        "support_count": 1,
        "record_ids": [
          "WG-004"
        ],
        "source_ids": [
          "WG-S3"
        ],
        "markets": [
          "other:ph"
        ],
        "years": null,
        "in_conflict": false
      }
    ],
    "transmissions": [
      {
        "value": "Automatic",
        "status": "NEEDS_SOURCE_RETRIEVAL",
        "integrity_states": [
          "SNIPPET_ONLY"
        ],
        "validated_record_ids": [],
        "best_tier": 3,
        "max_confidence": 0.6,
        "support_count": 2,
        "record_ids": [
          "WG-001",
          "WG-002"
        ],
        "source_ids": [
          "WG-S1"
        ],
        "markets": [
          "other:ph"
        ],
        "years": null,
        "in_conflict": false
      },
      {
        "value": "Manual",
        "status": "NEEDS_SOURCE_RETRIEVAL",
        "integrity_states": [
          "SNIPPET_ONLY"
        ],
        "validated_record_ids": [],
        "best_tier": 3,
        "max_confidence": 0.6,
        "support_count": 1,
        "record_ids": [
          "WG-003"
        ],
        "source_ids": [
          "WG-S1"
        ],
        "markets": [
          "other:ph"
        ],
        "years": null,
        "in_conflict": false
      }
    ],
    "transmission_variants": [
      {
        "value": "CVT",
        "status": "NEEDS_SOURCE_RETRIEVAL",
        "integrity_states": [
          "SNIPPET_ONLY"
        ],
        "validated_record_ids": [],
        "best_tier": 3,
        "max_confidence": 0.6,
        "support_count": 2,
        "record_ids": [
          "WG-001",
          "WG-002"
        ],
        "source_ids": [
          "WG-S1"
        ],
        "markets": [
          "other:ph"
        ],
        "years": null,
        "in_conflict": false
      }
    ],
    "transmission_gears": [
      {
        "value": 5,
        "status": "NEEDS_SOURCE_RETRIEVAL",
        "integrity_states": [
          "SNIPPET_ONLY"
        ],
        "validated_record_ids": [],
        "best_tier": 3,
        "max_confidence": 0.6,
        "support_count": 1,
        "record_ids": [
          "WG-003"
        ],
        "source_ids": [
          "WG-S1"
        ],
        "markets": [
          "other:ph"
        ],
        "years": null,
        "in_conflict": false
      }
    ],
    "drivetrains": [],
    "body_types": [],
    "seats": [
      {
        "value": 5,
        "status": "NEEDS_SOURCE_RETRIEVAL",
        "integrity_states": [
          "SNIPPET_ONLY"
        ],
        "validated_record_ids": [],
        "best_tier": 3,
        "max_confidence": 0.6,
        "support_count": 1,
        "record_ids": [
          "WG-005"
        ],
        "source_ids": [
          "WG-S2"
        ],
        "markets": [
          "other:ph"
        ],
        "years": null,
        "in_conflict": false
      }
    ],
    "doors": []
  },
  "conflicts": []
}
