{
  "schema_version": "carnet.model_union/2",
  "brand": "Toyota",
  "model": "Prius Prime",
  "generated_from": {
    "evidence_file": "evidence/toyota/prius_prime.json",
    "researched_at": "2026-10-03",
    "record_count": 6,
    "source_count": 2,
    "records_by_source_tier": {
      "1": 5,
      "2": 1
    },
    "records_by_integrity_state": {
      "FULL_TEXT_VERIFIED": 5,
      "PDF_VERIFIED": 1,
      "SNIPPET_ONLY": 0,
      "UNAVAILABLE": 0,
      "RETRIEVED_UNVERIFIABLE": 0
    },
    "sources_by_integrity_state": {
      "FULL_TEXT_VERIFIED": 1,
      "PDF_VERIFIED": 1,
      "SNIPPET_ONLY": 0,
      "UNAVAILABLE": 0,
      "RETRIEVED_UNVERIFIABLE": 0
    },
    "records_passing_integrity_test": 6
  },
  "research_coverage": [
    "US 2024 (third-generation, 2.0L plug-in hybrid, SE/XSE/XSE Premium): Toyota USA newsroom release + 2024 e-brochure",
    "NOT researched: 2017-2022 generation (1.8L plug-in hybrid, the generation the legacy dataset lists), markets outside the US, seats, doors, body type (no fetched source states a Prius Prime body type or seat count in a mappable way)",
    "Identity: the toyota.com '/priusprime/' URL now serves the Prius hybrid page; it was NOT used because it never says 'Prime'. Prius (HEV) and Prius Prime (PHEV) are kept as separate models"
  ],
  "vocabulary_version": "carnet.vocabulary/1",
  "production_policy": {
    "production_bound_section": "verified",
    "verified_requires": "tier 1-3 AND source integrity FULL_TEXT_VERIFIED or PDF_VERIFIED AND quote found in the preserved snapshot AND no unresolved tier 1-3 conflict",
    "includes_provisional": false,
    "includes_needs_source_retrieval": false,
    "provisional_values_live_in": "provisional_only (research output only; never auto-promoted)",
    "needs_source_retrieval_values_live_in": "needs_source_retrieval (tier 1-3 evidence whose source content was never validated; never auto-promoted)",
    "unresolved_conflicts": 0,
    "conflicts_block_promotion_until_reviewed": false,
    "review_status": "UNREVIEWED"
  },
  "verified": {
    "trims": [
      "SE",
      "XSE",
      "XSE Premium"
    ],
    "engine_sizes": [
      "2.0L"
    ],
    "cylinders": [
      4
    ],
    "fuel_types": [
      "Plug-in Hybrid"
    ],
    "transmissions": [
      "Automatic"
    ],
    "transmission_variants": [
      "CVT"
    ],
    "transmission_gears": [],
    "drivetrains": [
      "FWD"
    ],
    "body_types": [],
    "seats": [],
    "doors": []
  },
  "union": {
    "trims": [
      "SE",
      "XSE",
      "XSE Premium"
    ],
    "engine_sizes": [
      "2.0L"
    ],
    "cylinders": [
      4
    ],
    "fuel_types": [
      "Plug-in Hybrid"
    ],
    "transmissions": [
      "Automatic"
    ],
    "transmission_variants": [
      "CVT"
    ],
    "transmission_gears": [],
    "drivetrains": [
      "FWD"
    ],
    "body_types": [],
    "seats": [],
    "doors": []
  },
  "provisional_only": {
    "trims": [],
    "engine_sizes": [],
    "cylinders": [],
    "fuel_types": [],
    "transmissions": [],
    "transmission_variants": [],
    "transmission_gears": [],
    "drivetrains": [],
    "body_types": [],
    "seats": [],
    "doors": []
  },
  "needs_source_retrieval": {
    "trims": [],
    "engine_sizes": [],
    "cylinders": [],
    "fuel_types": [],
    "transmissions": [],
    "transmission_variants": [],
    "transmission_gears": [],
    "drivetrains": [],
    "body_types": [],
    "seats": [],
    "doors": []
  },
  "empty_dimensions": [
    "transmission_gears",
    "body_types",
    "seats",
    "doors"
  ],
  "engines": [
    {
      "engine_size_label": "2.0L",
      "displacement_cc": [],
      "cylinders": [
        4
      ],
      "fuel_types": [
        "Plug-in Hybrid"
      ],
      "aspirations": [],
      "power_hp": [
        {
          "value": 220.0,
          "record_id": "PP-005",
          "trim": null
        },
        {
          "value": 220.0,
          "record_id": "PP-006",
          "trim": null
        }
      ],
      "torque_nm": [],
      "best_tier": 1,
      "record_ids": [
        "PP-005",
        "PP-006"
      ]
    }
  ],
  "details": {
    "trims": [
      {
        "value": "SE",
        "status": "VERIFIED",
        "integrity_states": [
          "FULL_TEXT_VERIFIED"
        ],
        "validated_record_ids": [
          "PP-001"
        ],
        "best_tier": 1,
        "max_confidence": 0.93,
        "support_count": 1,
        "record_ids": [
          "PP-001"
        ],
        "source_ids": [
          "PP-S1"
        ],
        "markets": [
          "us"
        ],
        "years": [
          2024,
          2024
        ],
        "in_conflict": false
      },
      {
        "value": "XSE",
        "status": "VERIFIED",
        "integrity_states": [
          "FULL_TEXT_VERIFIED"
        ],
        "validated_record_ids": [
          "PP-002"
        ],
        "best_tier": 1,
        "max_confidence": 0.93,
        "support_count": 1,
        "record_ids": [
          "PP-002"
        ],
        "source_ids": [
          "PP-S1"
        ],
        "markets": [
          "us"
        ],
        "years": [
          2024,
          2024
        ],
        "in_conflict": false
      },
      {
        "value": "XSE Premium",
        "status": "VERIFIED",
        "integrity_states": [
          "FULL_TEXT_VERIFIED"
        ],
        "validated_record_ids": [
          "PP-003"
        ],
        "best_tier": 1,
        "max_confidence": 0.93,
        "support_count": 1,
        "record_ids": [
          "PP-003"
        ],
        "source_ids": [
          "PP-S1"
        ],
        "markets": [
          "us"
        ],
        "years": [
          2024,
          2024
        ],
        "in_conflict": false
      }
    ],
    "engine_sizes": [
      {
        "value": "2.0L",
        "status": "VERIFIED",
        "integrity_states": [
          "FULL_TEXT_VERIFIED",
          "PDF_VERIFIED"
        ],
        "validated_record_ids": [
          "PP-005",
          "PP-006"
        ],
        "best_tier": 1,
        "max_confidence": 0.93,
        "support_count": 2,
        "record_ids": [
          "PP-005",
          "PP-006"
        ],
        "source_ids": [
          "PP-S1",
          "PP-S2"
        ],
        "markets": [
          "us"
        ],
        "years": [
          2024,
          2024
        ],
        "in_conflict": false
      }
    ],
    "cylinders": [
      {
        "value": 4,
        "status": "VERIFIED",
        "integrity_states": [
          "FULL_TEXT_VERIFIED",
          "PDF_VERIFIED"
        ],
        "validated_record_ids": [
          "PP-005",
          "PP-006"
        ],
        "best_tier": 1,
        "max_confidence": 0.93,
        "support_count": 2,
        "record_ids": [
          "PP-005",
          "PP-006"
        ],
        "source_ids": [
          "PP-S1",
          "PP-S2"
        ],
        "markets": [
          "us"
        ],
        "years": [
          2024,
          2024
        ],
        "in_conflict": false
      }
    ],
    "fuel_types": [
      {
        "value": "Plug-in Hybrid",
        "status": "VERIFIED",
        "integrity_states": [
          "FULL_TEXT_VERIFIED",
          "PDF_VERIFIED"
        ],
        "validated_record_ids": [
          "PP-005",
          "PP-006"
        ],
        "best_tier": 1,
        "max_confidence": 0.93,
        "support_count": 2,
        "record_ids": [
          "PP-005",
          "PP-006"
        ],
        "source_ids": [
          "PP-S1",
          "PP-S2"
        ],
        "markets": [
          "us"
        ],
        "years": [
          2024,
          2024
        ],
        "in_conflict": false
      }
    ],
    "transmissions": [
      {
        "value": "Automatic",
        "status": "VERIFIED",
        "integrity_states": [
          "FULL_TEXT_VERIFIED"
        ],
        "validated_record_ids": [
          "PP-005"
        ],
        "best_tier": 1,
        "max_confidence": 0.93,
        "support_count": 1,
        "record_ids": [
          "PP-005"
        ],
        "source_ids": [
          "PP-S1"
        ],
        "markets": [
          "us"
        ],
        "years": [
          2024,
          2024
        ],
        "in_conflict": false
      }
    ],
    "transmission_variants": [
      {
        "value": "CVT",
        "status": "VERIFIED",
        "integrity_states": [
          "FULL_TEXT_VERIFIED"
        ],
        "validated_record_ids": [
          "PP-005"
        ],
        "best_tier": 1,
        "max_confidence": 0.93,
        "support_count": 1,
        "record_ids": [
          "PP-005"
        ],
        "source_ids": [
          "PP-S1"
        ],
        "markets": [
          "us"
        ],
        "years": [
          2024,
          2024
        ],
        "in_conflict": false
      }
    ],
    "transmission_gears": [],
    "drivetrains": [
      {
        "value": "FWD",
        "status": "VERIFIED",
        "integrity_states": [
          "FULL_TEXT_VERIFIED"
        ],
        "validated_record_ids": [
          "PP-004"
        ],
        "best_tier": 1,
        "max_confidence": 0.93,
        "support_count": 1,
        "record_ids": [
          "PP-004"
        ],
        "source_ids": [
          "PP-S1"
        ],
        "markets": [
          "us"
        ],
        "years": [
          2024,
          2024
        ],
        "in_conflict": false
      }
    ],
    "body_types": [],
    "seats": [],
    "doors": []
  },
  "conflicts": []
}
